{
  "schema" : "sbgn_pd.sch",
  "phase" : "basic",
  "valid" : true,
  "findings" : [ ],
  "backend" : {
    "language" : "java",
    "implementation" : "sbgn-validator-java",
    "implementation_version" : "0.1.1",
    "schematron_engine" : "ph-schematron-schxslt2 10.0.1 / SchXslt2",
    "xpath_engine" : "Saxon-HE",
    "xpath_version" : "12.10",
    "native_schematron" : true,
    "profile_version" : "libSBGN-Schematron-Profile-1"
  }
}