{
  "schema" : "sbgn_pd.sch",
  "phase" : "sanity",
  "valid" : false,
  "findings" : [ {
    "id" : "00000",
    "type" : "failed-assert",
    "role" : null,
    "flag" : null,
    "location" : "/Q{http://sbgn.org/libsbgn/0.3}sbgn[1]",
    "test" : "false()",
    "text" : "This assertion should always fail. Timestamp: <CURRENT_TIME> Namespace: http://sbgn.org/libsbgn/0.3",
    "diagnostic_references" : [ ],
    "derived" : {
      "element_id" : null,
      "element_kind" : "sbgn"
    }
  } ],
  "backend" : {
    "language" : "java",
    "implementation" : "sbgn-validator-java",
    "implementation_version" : "0.1.1",
    "schematron_engine" : "ph-schematron-schxslt2 10.0.1 / SchXslt2",
    "xpath_engine" : "Saxon-HE",
    "xpath_version" : "12.10",
    "native_schematron" : true,
    "profile_version" : "libSBGN-Schematron-Profile-1"
  }
}