{
  "schema": "sbgn_pd.sch",
  "phase": "basic",
  "valid": false,
  "findings": [
    {
      "id": "pd10110",
      "type": "failed-assert",
      "role": "error",
      "flag": null,
      "location": "/Q{http://sbgn.org/libsbgn/0.3}sbgn[1]/Q{http://sbgn.org/libsbgn/0.3}map[1]/Q{http://sbgn.org/libsbgn/0.3}arc[3]",
      "test": "$target-class='process' or $target-class='omitted process' or $target-class='uncertain process' or $target-class='association' or $target-class='dissociation' or $target-class='phenotype'",
      "text": "Modulation arc must have target reference to PN classes",
      "diagnostic_references": [
        {
          "diagnostic": "id",
          "text": "a1"
        },
        {
          "diagnostic": "target",
          "text": "glyph3"
        },
        {
          "diagnostic": "target-class",
          "text": "simple chemical"
        }
      ],
      "derived": {
        "element_id": "a1",
        "element_kind": "arc"
      }
    }
  ]
}
